00:38:35.050181 IP6 fe80::69:2bff:fe2a:d0f8 > ff02::2: ICMP6, router solicitation, length 16
00:38:35.136976 ARP, Request who-has 10.0.0.7 tell 10.0.0.1, length 28
00:38:35.138653 ARP, Reply 10.0.0.7 is-at f6:f6:3d:04:b2:b7, length 28
00:38:35.261680 IP6 fe80::2c4a:50ff:fe68:615a.5353 > ff02::fb.5353: 0 [2q] PTR (QM)? _ipps._tcp.local. PTR (QM)? _ipp._tcp.local. (45)
00:38:35.300513 IP 10.0.0.1 > 10.0.0.7: ICMP echo request, id 14874, seq 1, length 64
00:38:35.302549 IP 10.0.0.7 > 10.0.0.1: ICMP echo reply, id 14874, seq 1, length 64
00:38:35.624043 IP6 fe80::50f8:a2ff:fe45:e0db.5353 > ff02::fb.5353: 0 [2q] PTR (QM)? _ipps._tcp.local. PTR (QM)? _ipp._tcp.local. (45)
00:38:36.058194 IP 10.0.0.1 > 10.0.0.7: ICMP echo request, id 14874, seq 2, length 64
00:38:36.060227 IP 10.0.0.7 > 10.0.0.1: ICMP echo reply, id 14874, seq 2, length 64
00:38:36.369162 IP6 fe80::5442:34ff:fe55:d0d9 > ff02::2: ICMP6, router solicitation, length 16
00:38:36.392094 IP6 fe80::dc8c:cdff:fe12:dd9e > ff02::2: ICMP6, router solicitation, length 16
00:38:36.444013 IP6 fe80::90b3:b4ff:fe95:6a17 > ff02::2: ICMP6, router solicitation, length 16
00:38:36.501850 IP6 fe80::c37:3dff:fee8:cb37 > ff02::2: ICMP6, router solicitation, length 16
00:38:36.531748 IP6 fe80::8c79:76ff:fe92:8ae8 > ff02::2: ICMP6, router solicitation, length 16
00:38:36.620544 IP6 fe80::6c21:94ff:fee6:7c44 > ff02::2: ICMP6, router solicitation, length 16
00:38:36.770382 IP6 fe80::c98:f6ff:fe71:a6d7 > ff02::2: ICMP6, router solicitation, length 16
00:38:37.060430 IP 10.0.0.1 > 10.0.0.7: ICMP echo request, id 14874, seq 3, length 64
00:38:37.062418 IP 10.0.0.7 > 10.0.0.1: ICMP echo reply, id 14874, seq 3, length 64
00:38:37.601142 IP6 fe80::5c91:4dff:fe4e:b905 > ff02::2: ICMP6, router solicitation, length 16
00:38:37.621086 IP6 fe80::6842:c1ff:feac:e9d9 > ff02::2: ICMP6, router solicitation, length 16
00:38:37.732874 IP6 fe80::e0d5:afff:fe0b:38ae > ff02::2: ICMP6, router solicitation, length 16
00:38:38.061835 IP 10.0.0.1 > 10.0.0.7: ICMP echo request, id 14874, seq 4, length 64
00:38:38.063327 IP 10.0.0.7 > 10.0.0.1: ICMP echo reply, id 14874, seq 4, length 64
00:38:38.322793 IP6 fe80::e04c:37ff:fead:fc23 > ff02::2: ICMP6, router solicitation, length 16
00:38:38.345442 IP6 fe80::74f8:7fff:fe2f:31f9 > ff02::2: ICMP6, router solicitation, length 16
00:38:38.768184 IP6 fe80::9499:1cff:fe12:caac > ff02::2: ICMP6, router solicitation, length 16
00:38:38.977585 IP6 fe80::f4e5:34ff:fee5:8885 > ff02::2: ICMP6, router solicitation, length 16
00:38:39.063130 IP 10.0.0.1 > 10.0.0.7: ICMP echo request, id 14874, seq 5, length 64
00:38:39.065124 IP 10.0.0.7 > 10.0.0.1: ICMP echo reply, id 14874, seq 5, length 64
00:38:39.127867 IP6 fe80::8c79:76ff:fe92:8ae8.5353 > ff02::fb.5353: 0 [2q] PTR (QM)? _ipps._tcp.local. PTR (QM)? _ipp._tcp.local. (45)
00:38:39.816615 IP6 fe80::5442:34ff:fe55:d0d9.5353 > ff02::fb.5353: 0 [2q] PTR (QM)? _ipps._tcp.local. PTR (QM)? _ipp._tcp.local. (45)
00:38:39.861945 IP6 fe80::ec25:f1ff:fe2d:a4ba > ff02::2: ICMP6, router solicitation, length 16
00:38:39.987091 IP6 fe80::90b3:b4ff:fe95:6a17.5353 > ff02::fb.5353: 0 [2q] PTR (QM)? _ipps._tcp.local. PTR (QM)? _ipp._tcp.local. (45)
00:38:40.024985 IP6 fe80::dc8c:cdff:fe12:dd9e.5353 > ff02::fb.5353: 0 [2q] PTR (QM)? _ipps._tcp.local. PTR (QM)? _ipp._tcp.local. (45)
00:38:40.038899 IP6 fe80::b8bf:8bff:feec:b414 > ff02::2: ICMP6, router solicitation, length 16
00:38:40.064858 IP 10.0.0.1 > 10.0.0.7: ICMP echo request, id 14874, seq 6, length 64
00:38:40.066862 IP 10.0.0.7 > 10.0.0.1: ICMP echo reply, id 14874, seq 6, length 64
00:38:40.229432 IP6 fe80::f4f6:3dff:fe04:b2b7 > ff02::2: ICMP6, router solicitation, length 16
00:38:40.229445 IP6 fe80::50f8:a2ff:fe45:e0db > ff02::2: ICMP6, router solicitation, length 16
00:38:40.250359 IP6 fe80::ac80:88ff:fe53:d8a0 > ff02::2: ICMP6, router solicitation, length 16
00:38:40.486083 ARP, Request who-has 10.0.0.1 tell 10.0.0.7, length 28
00:38:40.487066 IP6 fe80::e04c:37ff:fead:fc23.5353 > ff02::fb.5353: 0 [2q] PTR (QM)? _ipps._tcp.local. PTR (QM)? _ipp._tcp.local. (45)
00:38:40.495094 IP6 fe80::2c4a:50ff:fe68:615a > ff02::2: ICMP6, router solicitation, length 16
00:38:40.572048 ARP, Reply 10.0.0.1 is-at 02:69:2b:2a:d0:f8, length 28
00:38:40.741592 IP6 fe80::e0d5:afff:fe0b:38ae.5353 > ff02::fb.5353: 0 [2q] PTR (QM)? _ipps._tcp.local. PTR (QM)? _ipp._tcp.local. (45)
00:38:40.761551 IP6 fe80::bc80:c0ff:fe5b:a53c > ff02::2: ICMP6, router solicitation, length 16
00:38:40.891296 IP6 fe80::5c91:4dff:fe4e:b905.5353 > ff02::fb.5353: 0 [2q] PTR (QM)? _ipps._tcp.local. PTR (QM)? _ipp._tcp.local. (45)
00:38:41.071491 IP 10.0.0.1 > 10.0.0.7: ICMP echo request, id 14874, seq 7, length 64
00:38:41.073345 IP 10.0.0.7 > 10.0.0.1: ICMP echo reply, id 14874, seq 7, length 64
00:38:41.560554 IP6 fe80::5450:96ff:fe86:95cb > ff02::2: ICMP6, router solicitation, length 16
00:38:41.792989 IP6 fe80::b8bf:8bff:feec:b414.5353 > ff02::fb.5353: 0 [2q] PTR (QM)? _ipps._tcp.local. PTR (QM)? _ipp._tcp.local. (45)
00:38:42.074919 IP 10.0.0.1 > 10.0.0.7: ICMP echo request, id 14874, seq 8, length 64
00:38:42.076981 IP 10.0.0.7 > 10.0.0.1: ICMP echo reply, id 14874, seq 8, length 64
00:38:42.125834 IP6 fe80::77:2cff:fed4:a8b0 > ff02::2: ICMP6, router solicitation, length 16
00:38:42.170675 IP6 fe80::74f8:7fff:fe2f:31f9.5353 > ff02::fb.5353: 0 [2q] PTR (QM)? _ipps._tcp.local. PTR (QM)? _ipp._tcp.local. (45)
00:38:42.542675 IP6 fe80::f4e5:34ff:fee5:8885.5353 > ff02::fb.5353: 0 [2q] PTR (QM)? _ipps._tcp.local. PTR (QM)? _ipp._tcp.local. (45)
00:38:42.841547 IP6 fe80::e840:3fff:fe45:6a46 > ff02::2: ICMP6, router solicitation, length 16
00:38:43.076940 IP 10.0.0.1 > 10.0.0.7: ICMP echo request, id 14874, seq 9, length 64
00:38:43.078759 IP 10.0.0.7 > 10.0.0.1: ICMP echo reply, id 14874, seq 9, length 64
00:38:43.256713 IP6 fe80::2c4a:50ff:fe68:615a.5353 > ff02::fb.5353: 0 [2q] PTR (QM)? _ipps._tcp.local. PTR (QM)? _ipp._tcp.local. (45)
00:38:43.625852 IP6 fe80::50f8:a2ff:fe45:e0db.5353 > ff02::fb.5353: 0 [2q] PTR (QM)? _ipps._tcp.local. PTR (QM)? _ipp._tcp.local. (45)
00:38:44.080854 IP 10.0.0.1 > 10.0.0.7: ICMP echo request, id 14874, seq 10, length 64
00:38:44.082820 IP 10.0.0.7 > 10.0.0.1: ICMP echo reply, id 14874, seq 10, length 64
00:38:45.080731 IP 10.0.0.1 > 10.0.0.7: ICMP echo request, id 14874, seq 11, length 64
00:38:45.082329 IP 10.0.0.7 > 10.0.0.1: ICMP echo reply, id 14874, seq 11, length 64
00:38:46.081453 IP 10.0.0.1 > 10.0.0.7: ICMP echo request, id 14874, seq 12, length 64
00:38:46.083938 IP 10.0.0.7 > 10.0.0.1: ICMP echo reply, id 14874, seq 12, length 64
00:38:47.085684 IP 10.0.0.1 > 10.0.0.7: ICMP echo request, id 14874, seq 13, length 64
00:38:47.087715 IP 10.0.0.7 > 10.0.0.1: ICMP echo reply, id 14874, seq 13, length 64
00:38:48.082780 IP 10.0.0.1 > 10.0.0.7: ICMP echo request, id 14874, seq 14, length 64
00:38:48.084942 IP 10.0.0.7 > 10.0.0.1: ICMP echo reply, id 14874, seq 14, length 64
00:38:49.087331 IP 10.0.0.1 > 10.0.0.7: ICMP echo request, id 14874, seq 15, length 64
00:38:49.089380 IP 10.0.0.7 > 10.0.0.1: ICMP echo reply, id 14874, seq 15, length 64
00:38:50.087813 IP 10.0.0.1 > 10.0.0.7: ICMP echo request, id 14874, seq 16, length 64
00:38:50.582202 IP6 fe80::69:2bff:fe2a:d0f8 > ff02::2: ICMP6, router solicitation, length 16
00:38:51.112756 IP 10.0.0.1 > 10.0.0.7: ICMP echo request, id 14874, seq 17, length 64
00:38:51.114852 IP 10.0.0.7 > 10.0.0.1: ICMP echo reply, id 14874, seq 17, length 64
00:38:51.362513 IP6 fe80::c98:f6ff:fe71:a6d7 > ff02::2: ICMP6, router solicitation, length 16
00:38:51.837289 IP6 fe80::c37:3dff:fee8:cb37 > ff02::2: ICMP6, router solicitation, length 16
00:38:51.881469 IP6 fe80::6c21:94ff:fee6:7c44 > ff02::2: ICMP6, router solicitation, length 16
00:38:52.120262 IP 10.0.0.1 > 10.0.0.7: ICMP echo request, id 14874, seq 18, length 64
00:38:52.122354 IP 10.0.0.7 > 10.0.0.1: ICMP echo reply, id 14874, seq 18, length 64
00:38:52.361000 IP6 fe80::5442:34ff:fe55:d0d9 > ff02::2: ICMP6, router solicitation, length 16
00:38:52.373636 IP6 fe80::74f8:7fff:fe2f:31f9 > ff02::2: ICMP6, router solicitation, length 16
00:38:53.105453 IP 10.0.0.1 > 10.0.0.7: ICMP echo request, id 14874, seq 19, length 64
00:38:53.107444 IP 10.0.0.7 > 10.0.0.1: ICMP echo reply, id 14874, seq 19, length 64
00:38:53.387361 IP6 fe80::5c91:4dff:fe4e:b905 > ff02::2: ICMP6, router solicitation, length 16
00:38:53.412272 IP6 fe80::9499:1cff:fe12:caac > ff02::2: ICMP6, router solicitation, length 16
00:38:53.604733 IP6 fe80::e0d5:afff:fe0b:38ae > ff02::2: ICMP6, router solicitation, length 16
00:38:54.109937 IP 10.0.0.1 > 10.0.0.7: ICMP echo request, id 14874, seq 20, length 64
00:38:54.111543 IP 10.0.0.7 > 10.0.0.1: ICMP echo reply, id 14874, seq 20, length 64
00:38:54.838851 IP6 fe80::f4e5:34ff:fee5:8885 > ff02::2: ICMP6, router solicitation, length 16
00:38:55.109627 IP 10.0.0.1 > 10.0.0.7: ICMP echo request, id 14874, seq 21, length 64
00:38:55.110711 IP 10.0.0.7 > 10.0.0.1: ICMP echo reply, id 14874, seq 21, length 64
00:38:55.132543 IP6 fe80::ac80:88ff:fe53:d8a0 > ff02::2: ICMP6, router solicitation, length 16
00:38:55.181458 IP6 fe80::8c79:76ff:fe92:8ae8.5353 > ff02::fb.5353: 0 [2q] PTR (QM)? _ipps._tcp.local. PTR (QM)? _ipp._tcp.local. (45)
00:38:55.223071 IP6 fe80::e04c:37ff:fead:fc23 > ff02::2: ICMP6, router solicitation, length 16
00:38:55.260309 IP6 fe80::6842:c1ff:feac:e9d9 > ff02::2: ICMP6, router solicitation, length 16
00:38:55.313607 IP6 fe80::8c79:76ff:fe92:8ae8 > ff02::2: ICMP6, router solicitation, length 16
00:38:55.332359 IP6 fe80::50f8:a2ff:fe45:e0db > ff02::2: ICMP6, router solicitation, length 16
00:38:55.418771 IP6 fe80::6842:c1ff:feac:e9d9.5353 > ff02::fb.5353: 0 [2q] PTR (QM)? _ipps._tcp.local. PTR (QM)? _ipp._tcp.local. (45)
00:38:55.743613 IP6 fe80::5442:34ff:fe55:d0d9.5353 > ff02::fb.5353: 0 [2q] PTR (QM)? _ipps._tcp.local. PTR (QM)? _ipp._tcp.local. (45)
00:38:55.846084 IP6 fe80::f4f6:3dff:fe04:b2b7 > ff02::2: ICMP6, router solicitation, length 16
00:38:55.952950 IP6 fe80::dc8c:cdff:fe12:dd9e.5353 > ff02::fb.5353: 0 [2q] PTR (QM)? _ipps._tcp.local. PTR (QM)? _ipp._tcp.local. (45)
00:38:56.086859 IP6 fe80::c37:3dff:fee8:cb37.5353 > ff02::fb.5353: 0 [2q] PTR (QM)? _ipps._tcp.local. PTR (QM)? _ipp._tcp.local. (45)
00:38:56.109784 IP 10.0.0.1 > 10.0.0.7: ICMP echo request, id 14874, seq 22, length 64
00:38:56.111772 IP 10.0.0.7 > 10.0.0.1: ICMP echo reply, id 14874, seq 22, length 64
00:38:56.492955 IP6 fe80::e04c:37ff:fead:fc23.5353 > ff02::fb.5353: 0 [2q] PTR (QM)? _ipps._tcp.local. PTR (QM)? _ipp._tcp.local. (45)
00:38:56.642250 IP6 fe80::5450:96ff:fe86:95cb > ff02::2: ICMP6, router solicitation, length 16
00:38:56.722208 IP6 fe80::e0d5:afff:fe0b:38ae.5353 > ff02::fb.5353: 0 [2q] PTR (QM)? _ipps._tcp.local. PTR (QM)? _ipp._tcp.local. (45)
00:38:56.886056 IP6 fe80::bc80:c0ff:fe5b:a53c > ff02::2: ICMP6, router solicitation, length 16
00:38:56.900041 IP6 fe80::5c91:4dff:fe4e:b905.5353 > ff02::fb.5353: 0 [2q] PTR (QM)? _ipps._tcp.local. PTR (QM)? _ipp._tcp.local. (45)
00:38:57.112844 IP 10.0.0.1 > 10.0.0.7: ICMP echo request, id 14874, seq 23, length 64
00:38:57.114956 IP 10.0.0.7 > 10.0.0.1: ICMP echo reply, id 14874, seq 23, length 64
00:38:57.139842 IP6 fe80::2c4a:50ff:fe68:615a > ff02::2: ICMP6, router solicitation, length 16
00:38:57.167785 IP6 fe80::ec25:f1ff:fe2d:a4ba > ff02::2: ICMP6, router solicitation, length 16
00:38:57.762275 IP6 fe80::b8bf:8bff:feec:b414.5353 > ff02::fb.5353: 0 [2q] PTR (QM)? _ipps._tcp.local. PTR (QM)? _ipp._tcp.local. (45)
00:38:58.093777 IP6 fe80::74f8:7fff:fe2f:31f9.5353 > ff02::fb.5353: 0 [2q] PTR (QM)? _ipps._tcp.local. PTR (QM)? _ipp._tcp.local. (45)
00:38:58.112641 IP 10.0.0.1 > 10.0.0.7: ICMP echo request, id 14874, seq 24, length 64
00:38:58.113993 IP 10.0.0.7 > 10.0.0.1: ICMP echo reply, id 14874, seq 24, length 64
00:38:58.538968 IP6 fe80::f4e5:34ff:fee5:8885.5353 > ff02::fb.5353: 0 [2q] PTR (QM)? _ipps._tcp.local. PTR (QM)? _ipp._tcp.local. (45)
00:38:59.111897 IP 10.0.0.1 > 10.0.0.7: ICMP echo request, id 14874, seq 25, length 64
00:38:59.113797 IP 10.0.0.7 > 10.0.0.1: ICMP echo reply, id 14874, seq 25, length 64
00:38:59.256577 IP6 fe80::b8bf:8bff:feec:b414 > ff02::2: ICMP6, router solicitation, length 16
00:38:59.284508 IP6 fe80::2c4a:50ff:fe68:615a.5353 > ff02::fb.5353: 0 [2q] PTR (QM)? _ipps._tcp.local. PTR (QM)? _ipp._tcp.local. (45)
00:38:59.316013 IP6 fe80::77:2cff:fed4:a8b0 > ff02::2: ICMP6, router solicitation, length 16
00:38:59.628092 IP6 fe80::50f8:a2ff:fe45:e0db.5353 > ff02::fb.5353: 0 [2q] PTR (QM)? _ipps._tcp.local. PTR (QM)? _ipp._tcp.local. (45)
00:39:00.113941 IP 10.0.0.1 > 10.0.0.7: ICMP echo request, id 14874, seq 26, length 64
00:39:00.115907 IP 10.0.0.7 > 10.0.0.1: ICMP echo reply, id 14874, seq 26, length 64
00:39:01.137368 IP 10.0.0.1 > 10.0.0.7: ICMP echo request, id 14874, seq 27, length 64
00:39:01.139394 IP 10.0.0.7 > 10.0.0.1: ICMP echo reply, id 14874, seq 27, length 64
00:39:01.244896 IP6 fe80::e840:3fff:fe45:6a46 > ff02::2: ICMP6, router solicitation, length 16
00:39:02.139451 IP 10.0.0.1 > 10.0.0.7: ICMP echo request, id 14874, seq 28, length 64
00:39:02.141483 IP 10.0.0.7 > 10.0.0.1: ICMP echo reply, id 14874, seq 28, length 64
00:39:03.139814 IP 10.0.0.1 > 10.0.0.7: ICMP echo request, id 14874, seq 29, length 64
00:39:03.141779 IP 10.0.0.7 > 10.0.0.1: ICMP echo reply, id 14874, seq 29, length 64
00:39:04.141850 IP 10.0.0.1 > 10.0.0.7: ICMP echo request, id 14874, seq 30, length 64
00:39:04.143893 IP 10.0.0.7 > 10.0.0.1: ICMP echo reply, id 14874, seq 30, length 64
00:39:05.142551 IP 10.0.0.1 > 10.0.0.7: ICMP echo request, id 14874, seq 31, length 64
00:39:05.143607 IP 10.0.0.7 > 10.0.0.1: ICMP echo reply, id 14874, seq 31, length 64
00:39:06.144025 IP 10.0.0.1 > 10.0.0.7: ICMP echo request, id 14874, seq 32, length 64
00:39:06.145132 IP 10.0.0.7 > 10.0.0.1: ICMP echo reply, id 14874, seq 32, length 64
00:39:07.144879 IP 10.0.0.1 > 10.0.0.7: ICMP echo request, id 14874, seq 33, length 64
00:39:07.146684 IP 10.0.0.7 > 10.0.0.1: ICMP echo reply, id 14874, seq 33, length 64
00:39:08.145402 IP 10.0.0.1 > 10.0.0.7: ICMP echo request, id 14874, seq 34, length 64
00:39:08.147413 IP 10.0.0.7 > 10.0.0.1: ICMP echo reply, id 14874, seq 34, length 64
00:39:09.153405 IP 10.0.0.1 > 10.0.0.7: ICMP echo request, id 14874, seq 35, length 64
00:39:09.162561 IP 10.0.0.7 > 10.0.0.1: ICMP echo reply, id 14874, seq 35, length 64
00:39:10.154008 IP 10.0.0.1 > 10.0.0.7: ICMP echo request, id 14874, seq 36, length 64
00:39:10.155988 IP 10.0.0.7 > 10.0.0.1: ICMP echo reply, id 14874, seq 36, length 64
00:39:11.157900 IP 10.0.0.1 > 10.0.0.7: ICMP echo request, id 14874, seq 37, length 64
00:39:11.159921 IP 10.0.0.7 > 10.0.0.1: ICMP echo reply, id 14874, seq 37, length 64
00:39:12.158471 IP 10.0.0.1 > 10.0.0.7: ICMP echo request, id 14874, seq 38, length 64
00:39:12.159624 IP 10.0.0.7 > 10.0.0.1: ICMP echo reply, id 14874, seq 38, length 64
00:39:13.159345 IP 10.0.0.1 > 10.0.0.7: ICMP echo request, id 14874, seq 39, length 64
00:39:13.161267 IP 10.0.0.7 > 10.0.0.1: ICMP echo reply, id 14874, seq 39, length 64
00:39:15.185343 IP 10.0.0.1 > 10.0.0.7: ICMP echo request, id 14874, seq 41, length 64
00:39:15.187430 IP 10.0.0.7 > 10.0.0.1: ICMP echo reply, id 14874, seq 41, length 64
00:39:16.186528 IP 10.0.0.1 > 10.0.0.7: ICMP echo request, id 14874, seq 42, length 64
00:39:16.188506 IP 10.0.0.7 > 10.0.0.1: ICMP echo reply, id 14874, seq 42, length 64
00:39:16.471771 ARP, Request who-has 10.0.0.7 tell 10.0.0.1, length 28
00:39:16.473905 ARP, Reply 10.0.0.7 is-at f6:f6:3d:04:b2:b7, length 28
00:39:17.188281 IP 10.0.0.1 > 10.0.0.7: ICMP echo request, id 14874, seq 43, length 64
00:39:17.190269 IP 10.0.0.7 > 10.0.0.1: ICMP echo reply, id 14874, seq 43, length 64
00:39:17.349323 ARP, Request who-has 10.0.0.1 tell 10.0.0.7, length 28
00:39:17.393354 ARP, Request who-has 10.0.0.7 tell 10.0.0.1, length 28
00:39:17.395099 ARP, Reply 10.0.0.7 is-at f6:f6:3d:04:b2:b7, length 28
00:39:18.198566 IP 10.0.0.1 > 10.0.0.7: ICMP echo request, id 14874, seq 44, length 64
00:39:18.200472 IP 10.0.0.7 > 10.0.0.1: ICMP echo reply, id 14874, seq 44, length 64
00:39:18.373982 ARP, Request who-has 10.0.0.1 tell 10.0.0.7, length 28
00:39:18.400064 ARP, Reply 10.0.0.1 is-at 02:69:2b:2a:d0:f8, length 28
00:39:19.201697 IP 10.0.0.1 > 10.0.0.7: ICMP echo request, id 14874, seq 45, length 64
00:39:19.204403 IP 10.0.0.7 > 10.0.0.1: ICMP echo reply, id 14874, seq 45, length 64
00:39:19.744893 IP6 fe80::dc8c:cdff:fe12:dd9e > ff02::2: ICMP6, router solicitation, length 16
00:39:20.202960 IP 10.0.0.1 > 10.0.0.7: ICMP echo request, id 14874, seq 46, length 64
00:39:20.204997 IP 10.0.0.7 > 10.0.0.1: ICMP echo reply, id 14874, seq 46, length 64
00:39:21.203050 IP 10.0.0.1 > 10.0.0.7: ICMP echo request, id 14874, seq 47, length 64
00:39:21.204494 IP 10.0.0.7 > 10.0.0.1: ICMP echo reply, id 14874, seq 47, length 64
00:39:21.777361 IP6 fe80::c37:3dff:fee8:cb37 > ff02::2: ICMP6, router solicitation, length 16
00:39:21.851169 IP6 fe80::c98:f6ff:fe71:a6d7 > ff02::2: ICMP6, router solicitation, length 16
00:39:21.875147 IP6 fe80::74f8:7fff:fe2f:31f9 > ff02::2: ICMP6, router solicitation, length 16
00:39:21.916050 IP6 fe80::9499:1cff:fe12:caac > ff02::2: ICMP6, router solicitation, length 16
00:39:21.962864 IP6 fe80::90b3:b4ff:fe95:6a17 > ff02::2: ICMP6, router solicitation, length 16
00:39:22.205412 IP 10.0.0.1 > 10.0.0.7: ICMP echo request, id 14874, seq 48, length 64
00:39:22.207407 IP 10.0.0.7 > 10.0.0.1: ICMP echo reply, id 14874, seq 48, length 64
00:39:23.206038 IP 10.0.0.1 > 10.0.0.7: ICMP echo request, id 14874, seq 49, length 64
00:39:23.207951 IP 10.0.0.7 > 10.0.0.1: ICMP echo reply, id 14874, seq 49, length 64
00:39:23.854279 IP6 fe80::69:2bff:fe2a:d0f8 > ff02::2: ICMP6, router solicitation, length 16
00:39:23.863231 IP6 fe80::6c21:94ff:fee6:7c44 > ff02::2: ICMP6, router solicitation, length 16
00:39:24.208802 IP 10.0.0.1 > 10.0.0.7: ICMP echo request, id 14874, seq 50, length 64
00:39:24.210762 IP 10.0.0.7 > 10.0.0.1: ICMP echo reply, id 14874, seq 50, length 64
00:39:25.207202 IP 10.0.0.1 > 10.0.0.7: ICMP echo request, id 14874, seq 51, length 64
00:39:25.209240 IP 10.0.0.7 > 10.0.0.1: ICMP echo reply, id 14874, seq 51, length 64
00:39:25.798134 IP6 fe80::50f8:a2ff:fe45:e0db > ff02::2: ICMP6, router solicitation, length 16
00:39:25.878797 IP6 fe80::e0d5:afff:fe0b:38ae > ff02::2: ICMP6, router solicitation, length 16
00:39:25.917643 IP6 fe80::5c91:4dff:fe4e:b905 > ff02::2: ICMP6, router solicitation, length 16
00:39:25.997423 IP6 fe80::5442:34ff:fe55:d0d9 > ff02::2: ICMP6, router solicitation, length 16
00:39:26.211473 IP 10.0.0.1 > 10.0.0.7: ICMP echo request, id 14874, seq 52, length 64
00:39:26.212693 IP 10.0.0.7 > 10.0.0.1: ICMP echo reply, id 14874, seq 52, length 64
00:39:27.114998 IP6 fe80::8c79:76ff:fe92:8ae8.5353 > ff02::fb.5353: 0 [2q] PTR (QM)? _ipps._tcp.local. PTR (QM)? _ipp._tcp.local. (45)
00:39:27.212290 IP 10.0.0.1 > 10.0.0.7: ICMP echo request, id 14874, seq 53, length 64
00:39:27.214316 IP 10.0.0.7 > 10.0.0.1: ICMP echo reply, id 14874, seq 53, length 64
00:39:27.420709 IP6 fe80::6842:c1ff:feac:e9d9.5353 > ff02::fb.5353: 0 [2q] PTR (QM)? _ipps._tcp.local. PTR (QM)? _ipp._tcp.local. (45)
00:39:27.747834 IP6 fe80::5442:34ff:fe55:d0d9.5353 > ff02::fb.5353: 0 [2q] PTR (QM)? _ipps._tcp.local. PTR (QM)? _ipp._tcp.local. (45)
00:39:27.844581 IP6 fe80::f4f6:3dff:fe04:b2b7 > ff02::2: ICMP6, router solicitation, length 16
00:39:27.866473 IP6 fe80::bc80:c0ff:fe5b:a53c > ff02::2: ICMP6, router solicitation, length 16
00:39:27.951282 IP6 fe80::ac80:88ff:fe53:d8a0 > ff02::2: ICMP6, router solicitation, length 16
00:39:27.987139 IP6 fe80::f4e5:34ff:fee5:8885 > ff02::2: ICMP6, router solicitation, length 16
00:39:28.034999 IP6 fe80::e04c:37ff:fead:fc23 > ff02::2: ICMP6, router solicitation, length 16
00:39:28.082390 IP6 fe80::90b3:b4ff:fe95:6a17.5353 > ff02::fb.5353: 0 [2q] PTR (QM)? _ipps._tcp.local. PTR (QM)? _ipp._tcp.local. (45)
00:39:28.124427 IP6 fe80::5450:96ff:fe86:95cb > ff02::2: ICMP6, router solicitation, length 16
00:39:28.215040 IP6 fe80::dc8c:cdff:fe12:dd9e.5353 > ff02::fb.5353: 0 [2q] PTR (QM)? _ipps._tcp.local. PTR (QM)? _ipp._tcp.local. (45)
00:39:28.217015 IP 10.0.0.1 > 10.0.0.7: ICMP echo request, id 14874, seq 54, length 64
00:39:28.219049 IP 10.0.0.7 > 10.0.0.1: ICMP echo reply, id 14874, seq 54, length 64
00:39:28.304776 IP6 fe80::c37:3dff:fee8:cb37.5353 > ff02::fb.5353: 0 [2q] PTR (QM)? _ipps._tcp.local. PTR (QM)? _ipp._tcp.local. (45)
00:39:28.501413 IP6 fe80::e04c:37ff:fead:fc23.5353 > ff02::fb.5353: 0 [2q] PTR (QM)? _ipps._tcp.local. PTR (QM)? _ipp._tcp.local. (45)
00:39:28.738619 IP6 fe80::e0d5:afff:fe0b:38ae.5353 > ff02::fb.5353: 0 [2q] PTR (QM)? _ipps._tcp.local. PTR (QM)? _ipp._tcp.local. (45)
00:39:28.955275 IP6 fe80::5c91:4dff:fe4e:b905.5353 > ff02::fb.5353: 0 [2q] PTR (QM)? _ipps._tcp.local. PTR (QM)? _ipp._tcp.local. (45)
00:39:29.232844 IP 10.0.0.1 > 10.0.0.7: ICMP echo request, id 14874, seq 55, length 64
00:39:29.234326 IP 10.0.0.7 > 10.0.0.1: ICMP echo reply, id 14874, seq 55, length 64
00:39:29.797512 IP6 fe80::b8bf:8bff:feec:b414.5353 > ff02::fb.5353: 0 [2q] PTR (QM)? _ipps._tcp.local. PTR (QM)? _ipp._tcp.local. (45)
00:39:29.973962 IP6 fe80::ec25:f1ff:fe2d:a4ba > ff02::2: ICMP6, router solicitation, length 16
00:39:30.102034 IP6 fe80::6842:c1ff:feac:e9d9 > ff02::2: ICMP6, router solicitation, length 16
00:39:30.232126 IP 10.0.0.1 > 10.0.0.7: ICMP echo request, id 14874, seq 56, length 64
00:39:30.233576 IP 10.0.0.7 > 10.0.0.1: ICMP echo reply, id 14874, seq 56, length 64
00:39:30.251727 IP6 fe80::8c79:76ff:fe92:8ae8 > ff02::2: ICMP6, router solicitation, length 16
00:39:30.270591 IP6 fe80::74f8:7fff:fe2f:31f9.5353 > ff02::fb.5353: 0 [2q] PTR (QM)? _ipps._tcp.local. PTR (QM)? _ipp._tcp.local. (45)
00:39:30.542440 IP6 fe80::f4e5:34ff:fee5:8885.5353 > ff02::fb.5353: 0 [2q] PTR (QM)? _ipps._tcp.local. PTR (QM)? _ipp._tcp.local. (45)
00:39:31.234973 IP 10.0.0.1 > 10.0.0.7: ICMP echo request, id 14874, seq 57, length 64
00:39:31.236140 IP 10.0.0.7 > 10.0.0.1: ICMP echo reply, id 14874, seq 57, length 64
00:39:31.263859 IP6 fe80::2c4a:50ff:fe68:615a.5353 > ff02::fb.5353: 0 [2q] PTR (QM)? _ipps._tcp.local. PTR (QM)? _ipp._tcp.local. (45)
00:39:31.627326 IP6 fe80::50f8:a2ff:fe45:e0db.5353 > ff02::fb.5353: 0 [2q] PTR (QM)? _ipps._tcp.local. PTR (QM)? _ipp._tcp.local. (45)
00:39:31.984970 IP6 fe80::2c4a:50ff:fe68:615a > ff02::2: ICMP6, router solicitation, length 16
00:39:32.058725 IP6 fe80::77:2cff:fed4:a8b0 > ff02::2: ICMP6, router solicitation, length 16
00:39:32.238414 IP 10.0.0.1 > 10.0.0.7: ICMP echo request, id 14874, seq 58, length 64
00:39:32.239581 IP 10.0.0.7 > 10.0.0.1: ICMP echo reply, id 14874, seq 58, length 64
00:39:33.240102 IP 10.0.0.1 > 10.0.0.7: ICMP echo request, id 14874, seq 59, length 64
00:39:33.241500 IP 10.0.0.7 > 10.0.0.1: ICMP echo reply, id 14874, seq 59, length 64
00:39:34.261771 IP 10.0.0.1 > 10.0.0.7: ICMP echo request, id 14874, seq 60, length 64
00:39:34.263708 IP 10.0.0.7 > 10.0.0.1: ICMP echo reply, id 14874, seq 60, length 64
00:39:35.243508 IP 10.0.0.1 > 10.0.0.7: ICMP echo request, id 14874, seq 61, length 64
00:39:35.247131 IP 10.0.0.7 > 10.0.0.1: ICMP echo reply, id 14874, seq 61, length 64
00:39:36.109366 IP6 fe80::b8bf:8bff:feec:b414 > ff02::2: ICMP6, router solicitation, length 16
00:39:36.259342 IP 10.0.0.1 > 10.0.0.7: ICMP echo request, id 14874, seq 62, length 64
00:39:36.262976 IP 10.0.0.7 > 10.0.0.1: ICMP echo reply, id 14874, seq 62, length 64
00:39:37.248226 IP 10.0.0.1 > 10.0.0.7: ICMP echo request, id 14874, seq 63, length 64
00:39:37.250397 IP 10.0.0.7 > 10.0.0.1: ICMP echo reply, id 14874, seq 63, length 64
00:39:38.251202 IP 10.0.0.1 > 10.0.0.7: ICMP echo request, id 14874, seq 64, length 64
00:39:38.253345 IP 10.0.0.7 > 10.0.0.1: ICMP echo reply, id 14874, seq 64, length 64
00:39:39.252378 IP 10.0.0.1 > 10.0.0.7: ICMP echo request, id 14874, seq 65, length 64
00:39:39.254262 IP 10.0.0.7 > 10.0.0.1: ICMP echo reply, id 14874, seq 65, length 64
00:39:40.252840 IP 10.0.0.1 > 10.0.0.7: ICMP echo request, id 14874, seq 66, length 64
00:39:40.254750 IP 10.0.0.7 > 10.0.0.1: ICMP echo reply, id 14874, seq 66, length 64
00:39:41.255406 IP 10.0.0.1 > 10.0.0.7: ICMP echo request, id 14874, seq 67, length 64
00:39:41.256695 IP 10.0.0.7 > 10.0.0.1: ICMP echo reply, id 14874, seq 67, length 64
00:39:42.263085 IP 10.0.0.1 > 10.0.0.7: ICMP echo request, id 14874, seq 68, length 64
00:39:42.266517 IP 10.0.0.7 > 10.0.0.1: ICMP echo reply, id 14874, seq 68, length 64
00:39:43.259581 IP 10.0.0.1 > 10.0.0.7: ICMP echo request, id 14874, seq 69, length 64
00:39:43.263134 IP 10.0.0.7 > 10.0.0.1: ICMP echo reply, id 14874, seq 69, length 64
00:39:44.259361 IP 10.0.0.1 > 10.0.0.7: ICMP echo request, id 14874, seq 70, length 64
00:39:44.260937 IP 10.0.0.7 > 10.0.0.1: ICMP echo reply, id 14874, seq 70, length 64
00:39:45.267455 IP 10.0.0.1 > 10.0.0.7: ICMP echo request, id 14874, seq 71, length 64
00:39:45.269715 IP 10.0.0.7 > 10.0.0.1: ICMP echo reply, id 14874, seq 71, length 64
00:39:47.299594 IP 10.0.0.1 > 10.0.0.7: ICMP echo request, id 14874, seq 73, length 64
00:39:47.306299 IP 10.0.0.7 > 10.0.0.1: ICMP echo reply, id 14874, seq 73, length 64
00:39:48.292359 IP 10.0.0.1 > 10.0.0.7: ICMP echo request, id 14874, seq 74, length 64
00:39:48.296369 IP 10.0.0.7 > 10.0.0.1: ICMP echo reply, id 14874, seq 74, length 64
00:39:49.286717 IP 10.0.0.1 > 10.0.0.7: ICMP echo request, id 14874, seq 75, length 64
00:39:49.289194 IP 10.0.0.7 > 10.0.0.1: ICMP echo reply, id 14874, seq 75, length 64
00:39:51.313274 IP 10.0.0.1 > 10.0.0.7: ICMP echo request, id 14874, seq 77, length 64
00:39:51.315714 IP 10.0.0.7 > 10.0.0.1: ICMP echo reply, id 14874, seq 77, length 64
00:39:52.312174 IP 10.0.0.1 > 10.0.0.7: ICMP echo request, id 14874, seq 78, length 64
00:39:52.314194 IP 10.0.0.7 > 10.0.0.1: ICMP echo reply, id 14874, seq 78, length 64
00:39:53.316534 IP 10.0.0.1 > 10.0.0.7: ICMP echo request, id 14874, seq 79, length 64
00:39:53.330611 IP 10.0.0.7 > 10.0.0.1: ICMP echo reply, id 14874, seq 79, length 64
00:39:54.316511 IP 10.0.0.1 > 10.0.0.7: ICMP echo request, id 14874, seq 80, length 64
00:39:54.318109 IP 10.0.0.7 > 10.0.0.1: ICMP echo reply, id 14874, seq 80, length 64
00:39:56.516512 ARP, Request who-has 10.0.0.1 tell 10.0.0.7, length 28
