21:49:26.686044 IP6 fe80::b8c5:70ff:fe4f:493c.5353 > ff02::fb.5353: 0*- [0q] 2/0/0 (Cache flush) PTR ubuntu.local., (Cache flush) AAAA fe80::b8c5:70ff:fe4f:493c (138)
21:49:27.626141 IP6 fe80::b8c5:70ff:fe4f:493c.5353 > ff02::fb.5353: 0 [2q] PTR (QM)? _ipps._tcp.local. PTR (QM)? _ipp._tcp.local. (45)
21:49:28.037667 IP6 fe80::a046:6cff:fe87:f2ed > ff02::2: ICMP6, router solicitation, length 16
21:49:28.071289 IP6 fe80::30b5:2aff:fef8:f16f > ff02::2: ICMP6, router solicitation, length 16
21:49:28.121131 IP6 fe80::5073:e0ff:fe07:ab0b > ff02::2: ICMP6, router solicitation, length 16
21:49:28.153069 IP6 fe80::8427:b1ff:fe18:c349 > ff02::2: ICMP6, router solicitation, length 16
21:49:28.197949 IP6 fe80::2827:a8ff:fe99:5ac2.5353 > ff02::fb.5353: 0*- [0q] 2/0/0 (Cache flush) PTR ubuntu.local., (Cache flush) AAAA fe80::2827:a8ff:fe99:5ac2 (138)
21:49:28.225039 IP6 fe80::28a6:39ff:fe4c:396e > ff02::2: ICMP6, router solicitation, length 16
21:49:28.288875 IP6 fe80::5c2b:b7ff:feb0:465e.5353 > ff02::fb.5353: 0 [2q] PTR (QM)? _ipps._tcp.local. PTR (QM)? _ipp._tcp.local. (45)
21:49:28.363301 IP6 fe80::4814:3dff:fe4f:9c00.5353 > ff02::fb.5353: 0 [2q] PTR (QM)? _ipps._tcp.local. PTR (QM)? _ipp._tcp.local. (45)
21:49:28.563647 IP6 fe80::981a:9aff:feb4:984e > ff02::2: ICMP6, router solicitation, length 16
21:49:28.574564 IP6 fe80::30b5:2aff:fef8:f16f.5353 > ff02::fb.5353: 0*- [0q] 2/0/0 (Cache flush) PTR ubuntu.local., (Cache flush) AAAA fe80::30b5:2aff:fef8:f16f (138)
21:49:28.586546 IP6 fe80::342c:50ff:fe4d:7c1 > ff02::2: ICMP6, router solicitation, length 16
21:49:28.684325 ARP, Request who-has 10.0.0.7 tell 10.0.0.1, length 28
21:49:28.686322 ARP, Reply 10.0.0.7 is-at a2:46:6c:87:f2:ed, length 28
21:49:28.817297 IP 10.0.0.1 > 10.0.0.7: ICMP echo request, id 14702, seq 2, length 64
21:49:28.819324 IP 10.0.0.7 > 10.0.0.1: ICMP echo reply, id 14702, seq 2, length 64
21:49:28.826147 IP 10.0.0.1 > 10.0.0.7: ICMP echo request, id 14702, seq 1, length 64
21:49:28.828182 IP 10.0.0.7 > 10.0.0.1: ICMP echo reply, id 14702, seq 1, length 64
21:49:28.832574 IP 10.0.0.1 > 10.0.0.7: ICMP echo request, id 14702, seq 3, length 64
21:49:28.834113 IP 10.0.0.7 > 10.0.0.1: ICMP echo reply, id 14702, seq 3, length 64
21:49:28.889986 IP6 fe80::b8c5:70ff:fe4f:493c.5353 > ff02::fb.5353: 0*- [0q] 2/0/0 (Cache flush) PTR ubuntu.local., (Cache flush) AAAA fe80::b8c5:70ff:fe4f:493c (138)
21:49:28.896956 IP6 fe80::89d:5bff:fe73:182e.5353 > ff02::fb.5353: 0 [2q] PTR (QM)? _ipps._tcp.local. PTR (QM)? _ipp._tcp.local. (45)
21:49:29.061878 IP6 fe80::b8c5:70ff:fe4f:493c > ff02::2: ICMP6, router solicitation, length 16
21:49:29.422899 IP6 fe80::30e4:82ff:fe19:37d9.5353 > ff02::fb.5353: 0 [2q] PTR (QM)? _ipps._tcp.local. PTR (QM)? _ipp._tcp.local. (45)
21:49:29.495935 IP6 fe80::a8a2:bdff:fe51:bc60.5353 > ff02::fb.5353: 0 [2q] PTR (QM)? _ipps._tcp.local. PTR (QM)? _ipp._tcp.local. (45)
21:49:29.681606 IP6 fe80::9c5e:9aff:fe7c:f9fb.5353 > ff02::fb.5353: 0 [2q] PTR (QM)? _ipps._tcp.local. PTR (QM)? _ipp._tcp.local. (45)
21:49:30.430884 IP6 fe80::90ea:86ff:fe2c:8786.5353 > ff02::fb.5353: 0 [2q] PTR (QM)? _ipps._tcp.local. PTR (QM)? _ipp._tcp.local. (45)
21:49:30.496994 IP6 fe80::2ccd:ceff:fe82:f568.5353 > ff02::fb.5353: 0 [2q] PTR (QM)? _ipps._tcp.local. PTR (QM)? _ipp._tcp.local. (45)
21:49:30.609638 IP 10.0.0.1 > 10.0.0.7: ICMP echo request, id 14702, seq 5, length 64
21:49:30.611653 IP 10.0.0.7 > 10.0.0.1: ICMP echo reply, id 14702, seq 5, length 64
21:49:30.633541 IP6 fe80::8427:b1ff:fe18:c349.5353 > ff02::fb.5353: 0 [2q] PTR (QM)? _ipps._tcp.local. PTR (QM)? _ipp._tcp.local. (45)
21:49:31.318180 IP6 fe80::30b5:2aff:fef8:f16f.5353 > ff02::fb.5353: 0 [2q] PTR (QM)? _ipps._tcp.local. PTR (QM)? _ipp._tcp.local. (45)
21:49:31.627809 IP6 fe80::b8c5:70ff:fe4f:493c.5353 > ff02::fb.5353: 0 [2q] PTR (QM)? _ipps._tcp.local. PTR (QM)? _ipp._tcp.local. (45)
21:49:32.624503 IP 10.0.0.1 > 10.0.0.7: ICMP echo request, id 14702, seq 7, length 64
21:49:32.626558 IP 10.0.0.7 > 10.0.0.1: ICMP echo reply, id 14702, seq 7, length 64
21:49:33.466863 IP6 fe80::1c33:aeff:fefc:bfb7 > ff02::2: ICMP6, router solicitation, length 16
21:49:33.493020 IP6 fe80::30e4:82ff:fe19:37d9 > ff02::2: ICMP6, router solicitation, length 16
21:49:33.623283 IP 10.0.0.1 > 10.0.0.7: ICMP echo request, id 14702, seq 8, length 64
21:49:33.625255 IP 10.0.0.7 > 10.0.0.1: ICMP echo reply, id 14702, seq 8, length 64
21:49:33.736363 IP6 fe80::c46e:26ff:feb7:af1e > ff02::2: ICMP6, router solicitation, length 16
21:49:33.925884 ARP, Request who-has 10.0.0.1 tell 10.0.0.7, length 28
21:49:34.007401 IP6 fe80::4814:3dff:fe4f:9c00 > ff02::2: ICMP6, router solicitation, length 16
21:49:34.061436 ARP, Reply 10.0.0.1 is-at 4a:5d:a7:20:b8:87, length 28
21:49:34.627065 IP 10.0.0.1 > 10.0.0.7: ICMP echo request, id 14702, seq 9, length 64
21:49:34.629046 IP 10.0.0.7 > 10.0.0.1: ICMP echo reply, id 14702, seq 9, length 64
21:49:34.776617 IP6 fe80::5c2b:b7ff:feb0:465e > ff02::2: ICMP6, router solicitation, length 16
21:49:34.791613 IP6 fe80::485d:a7ff:fe20:b887 > ff02::2: ICMP6, router solicitation, length 16
21:49:35.019758 IP6 fe80::90ea:86ff:fe2c:8786 > ff02::2: ICMP6, router solicitation, length 16
21:49:35.054676 IP6 fe80::49e:55ff:fe37:a2c1 > ff02::2: ICMP6, router solicitation, length 16
21:49:35.095554 IP6 fe80::2ccd:ceff:fe82:f568 > ff02::2: ICMP6, router solicitation, length 16
21:49:35.135373 IP6 fe80::a8a2:bdff:fe51:bc60 > ff02::2: ICMP6, router solicitation, length 16
21:49:35.272974 IP6 fe80::9c5e:9aff:fe7c:f9fb > ff02::2: ICMP6, router solicitation, length 16
21:49:35.480100 IP6 fe80::30b5:2aff:fef8:f16f > ff02::2: ICMP6, router solicitation, length 16
21:49:35.629299 IP 10.0.0.1 > 10.0.0.7: ICMP echo request, id 14702, seq 10, length 64
21:49:35.631128 IP 10.0.0.7 > 10.0.0.1: ICMP echo reply, id 14702, seq 10, length 64
21:49:35.750710 IP6 fe80::2827:a8ff:fe99:5ac2 > ff02::2: ICMP6, router solicitation, length 16
21:49:36.044740 IP6 fe80::d44d:e5ff:fefb:dd7c > ff02::2: ICMP6, router solicitation, length 16
21:49:36.229832 IP6 fe80::a046:6cff:fe87:f2ed > ff02::2: ICMP6, router solicitation, length 16
21:49:36.248773 IP6 fe80::981a:9aff:feb4:984e > ff02::2: ICMP6, router solicitation, length 16
21:49:36.291706 IP6 fe80::5c2b:b7ff:feb0:465e.5353 > ff02::fb.5353: 0 [2q] PTR (QM)? _ipps._tcp.local. PTR (QM)? _ipp._tcp.local. (45)
21:49:36.391459 IP6 fe80::4814:3dff:fe4f:9c00.5353 > ff02::fb.5353: 0 [2q] PTR (QM)? _ipps._tcp.local. PTR (QM)? _ipp._tcp.local. (45)
21:49:36.502210 IP6 fe80::342c:50ff:fe4d:7c1 > ff02::2: ICMP6, router solicitation, length 16
21:49:36.627480 IP 10.0.0.1 > 10.0.0.7: ICMP echo request, id 14702, seq 11, length 64
21:49:36.629532 IP 10.0.0.7 > 10.0.0.1: ICMP echo reply, id 14702, seq 11, length 64
21:49:36.786972 IP6 fe80::28a6:39ff:fe4c:396e > ff02::2: ICMP6, router solicitation, length 16
21:49:36.851956 IP6 fe80::89d:5bff:fe73:182e.5353 > ff02::fb.5353: 0 [2q] PTR (QM)? _ipps._tcp.local. PTR (QM)? _ipp._tcp.local. (45)
21:49:37.123846 IP6 fe80::8427:b1ff:fe18:c349 > ff02::2: ICMP6, router solicitation, length 16
21:49:37.238907 IP6 fe80::49e:55ff:fe37:a2c1.5353 > ff02::fb.5353: 0 [2q] PTR (QM)? _ipps._tcp.local. PTR (QM)? _ipp._tcp.local. (45)
21:49:37.407106 IP6 fe80::1c33:aeff:fefc:bfb7.5353 > ff02::fb.5353: 0 [2q] PTR (QM)? _ipps._tcp.local. PTR (QM)? _ipp._tcp.local. (45)
21:49:37.423072 IP6 fe80::30e4:82ff:fe19:37d9.5353 > ff02::fb.5353: 0 [2q] PTR (QM)? _ipps._tcp.local. PTR (QM)? _ipp._tcp.local. (45)
21:49:37.498070 IP6 fe80::a8a2:bdff:fe51:bc60.5353 > ff02::fb.5353: 0 [2q] PTR (QM)? _ipps._tcp.local. PTR (QM)? _ipp._tcp.local. (45)
21:49:37.631382 IP 10.0.0.1 > 10.0.0.7: ICMP echo request, id 14702, seq 12, length 64
21:49:37.633043 IP 10.0.0.7 > 10.0.0.1: ICMP echo reply, id 14702, seq 12, length 64
21:49:37.680288 IP6 fe80::9c5e:9aff:fe7c:f9fb.5353 > ff02::fb.5353: 0 [2q] PTR (QM)? _ipps._tcp.local. PTR (QM)? _ipp._tcp.local. (45)
21:49:38.021533 IP6 fe80::b8c5:70ff:fe4f:493c > ff02::2: ICMP6, router solicitation, length 16
21:49:38.431254 IP6 fe80::90ea:86ff:fe2c:8786.5353 > ff02::fb.5353: 0 [2q] PTR (QM)? _ipps._tcp.local. PTR (QM)? _ipp._tcp.local. (45)
21:49:38.547632 IP6 fe80::2ccd:ceff:fe82:f568.5353 > ff02::fb.5353: 0 [2q] PTR (QM)? _ipps._tcp.local. PTR (QM)? _ipp._tcp.local. (45)
21:49:38.629713 IP 10.0.0.1 > 10.0.0.7: ICMP echo request, id 14702, seq 13, length 64
21:49:38.632083 IP 10.0.0.7 > 10.0.0.1: ICMP echo reply, id 14702, seq 13, length 64
21:49:38.695083 IP6 fe80::8427:b1ff:fe18:c349.5353 > ff02::fb.5353: 0 [2q] PTR (QM)? _ipps._tcp.local. PTR (QM)? _ipp._tcp.local. (45)
21:49:38.923231 IP6 fe80::2827:a8ff:fe99:5ac2.5353 > ff02::fb.5353: 0 [2q] PTR (QM)? _ipps._tcp.local. PTR (QM)? _ipp._tcp.local. (45)
21:49:39.399110 IP6 fe80::30b5:2aff:fef8:f16f.5353 > ff02::fb.5353: 0 [2q] PTR (QM)? _ipps._tcp.local. PTR (QM)? _ipp._tcp.local. (45)
21:49:39.629004 IP6 fe80::b8c5:70ff:fe4f:493c.5353 > ff02::fb.5353: 0 [2q] PTR (QM)? _ipps._tcp.local. PTR (QM)? _ipp._tcp.local. (45)
21:49:39.664440 IP 10.0.0.1 > 10.0.0.7: ICMP echo request, id 14702, seq 14, length 64
21:49:39.666447 IP 10.0.0.7 > 10.0.0.1: ICMP echo reply, id 14702, seq 14, length 64
21:49:40.668379 IP 10.0.0.1 > 10.0.0.7: ICMP echo request, id 14702, seq 15, length 64
21:49:40.670449 IP 10.0.0.7 > 10.0.0.1: ICMP echo reply, id 14702, seq 15, length 64
21:49:41.667322 IP 10.0.0.1 > 10.0.0.7: ICMP echo request, id 14702, seq 16, length 64
21:49:41.669398 IP 10.0.0.7 > 10.0.0.1: ICMP echo reply, id 14702, seq 16, length 64
21:49:42.669681 IP 10.0.0.1 > 10.0.0.7: ICMP echo request, id 14702, seq 17, length 64
21:49:42.672168 IP 10.0.0.7 > 10.0.0.1: ICMP echo reply, id 14702, seq 17, length 64
21:49:43.669508 IP 10.0.0.1 > 10.0.0.7: ICMP echo request, id 14702, seq 18, length 64
21:49:43.671281 IP 10.0.0.7 > 10.0.0.1: ICMP echo reply, id 14702, seq 18, length 64
21:49:44.672411 IP 10.0.0.1 > 10.0.0.7: ICMP echo request, id 14702, seq 19, length 64
21:49:44.673689 IP 10.0.0.7 > 10.0.0.1: ICMP echo reply, id 14702, seq 19, length 64
21:49:45.673836 IP 10.0.0.1 > 10.0.0.7: ICMP echo request, id 14702, seq 20, length 64
21:49:45.675886 IP 10.0.0.7 > 10.0.0.1: ICMP echo reply, id 14702, seq 20, length 64
21:49:46.674973 IP 10.0.0.1 > 10.0.0.7: ICMP echo request, id 14702, seq 21, length 64
21:49:46.676964 IP 10.0.0.7 > 10.0.0.1: ICMP echo reply, id 14702, seq 21, length 64
21:49:47.325738 IP6 fe80::30e4:82ff:fe19:37d9 > ff02::2: ICMP6, router solicitation, length 16
21:49:47.536955 IP6 fe80::1c33:aeff:fefc:bfb7 > ff02::2: ICMP6, router solicitation, length 16
21:49:47.677685 IP 10.0.0.1 > 10.0.0.7: ICMP echo request, id 14702, seq 22, length 64
21:49:47.679652 IP 10.0.0.7 > 10.0.0.1: ICMP echo reply, id 14702, seq 22, length 64
21:49:47.809078 IP6 fe80::89d:5bff:fe73:182e > ff02::2: ICMP6, router solicitation, length 16
21:49:48.583603 IP6 fe80::c46e:26ff:feb7:af1e > ff02::2: ICMP6, router solicitation, length 16
21:49:48.676368 IP 10.0.0.1 > 10.0.0.7: ICMP echo request, id 14702, seq 23, length 64
21:49:48.677489 IP 10.0.0.7 > 10.0.0.1: ICMP echo reply, id 14702, seq 23, length 64
21:49:49.679144 IP 10.0.0.1 > 10.0.0.7: ICMP echo request, id 14702, seq 24, length 64
21:49:49.680342 IP 10.0.0.7 > 10.0.0.1: ICMP echo reply, id 14702, seq 24, length 64
21:49:49.816930 IP6 fe80::30b5:2aff:fef8:f16f > ff02::2: ICMP6, router solicitation, length 16
21:49:49.841888 IP6 fe80::2ccd:ceff:fe82:f568 > ff02::2: ICMP6, router solicitation, length 16
21:49:50.341491 IP6 fe80::90ea:86ff:fe2c:8786 > ff02::2: ICMP6, router solicitation, length 16
21:49:50.679408 IP 10.0.0.1 > 10.0.0.7: ICMP echo request, id 14702, seq 25, length 64
21:49:50.680482 IP 10.0.0.7 > 10.0.0.1: ICMP echo reply, id 14702, seq 25, length 64
21:49:51.400709 IP6 fe80::2827:a8ff:fe99:5ac2 > ff02::2: ICMP6, router solicitation, length 16
21:49:51.419727 IP6 fe80::4814:3dff:fe4f:9c00 > ff02::2: ICMP6, router solicitation, length 16
21:49:51.435667 IP6 fe80::485d:a7ff:fe20:b887 > ff02::2: ICMP6, router solicitation, length 16
21:49:51.680399 IP 10.0.0.1 > 10.0.0.7: ICMP echo request, id 14702, seq 26, length 64
21:49:51.682380 IP 10.0.0.7 > 10.0.0.1: ICMP echo reply, id 14702, seq 26, length 64
21:49:52.114981 IP6 fe80::981a:9aff:feb4:984e > ff02::2: ICMP6, router solicitation, length 16
21:49:52.255923 IP6 fe80::5c2b:b7ff:feb0:465e.5353 > ff02::fb.5353: 0 [2q] PTR (QM)? _ipps._tcp.local. PTR (QM)? _ipp._tcp.local. (45)
21:49:52.336245 IP6 fe80::4814:3dff:fe4f:9c00.5353 > ff02::fb.5353: 0 [2q] PTR (QM)? _ipps._tcp.local. PTR (QM)? _ipp._tcp.local. (45)
21:49:52.358000 IP6 fe80::a046:6cff:fe87:f2ed > ff02::2: ICMP6, router solicitation, length 16
21:49:52.377728 IP6 fe80::342c:50ff:fe4d:7c1 > ff02::2: ICMP6, router solicitation, length 16
21:49:52.676650 IP 10.0.0.1 > 10.0.0.7: ICMP echo request, id 14702, seq 27, length 64
21:49:52.677776 IP 10.0.0.7 > 10.0.0.1: ICMP echo reply, id 14702, seq 27, length 64
21:49:52.856368 IP6 fe80::89d:5bff:fe73:182e.5353 > ff02::fb.5353: 0 [2q] PTR (QM)? _ipps._tcp.local. PTR (QM)? _ipp._tcp.local. (45)
21:49:53.237493 IP6 fe80::49e:55ff:fe37:a2c1.5353 > ff02::fb.5353: 0 [2q] PTR (QM)? _ipps._tcp.local. PTR (QM)? _ipp._tcp.local. (45)
21:49:53.431528 IP6 fe80::1c33:aeff:fefc:bfb7.5353 > ff02::fb.5353: 0 [2q] PTR (QM)? _ipps._tcp.local. PTR (QM)? _ipp._tcp.local. (45)
21:49:53.469413 IP6 fe80::9c5e:9aff:fe7c:f9fb > ff02::2: ICMP6, router solicitation, length 16
21:49:53.498297 IP6 fe80::30e4:82ff:fe19:37d9.5353 > ff02::fb.5353: 0 [2q] PTR (QM)? _ipps._tcp.local. PTR (QM)? _ipp._tcp.local. (45)
21:49:53.527245 IP6 fe80::49e:55ff:fe37:a2c1 > ff02::2: ICMP6, router solicitation, length 16
21:49:53.563162 IP6 fe80::5c2b:b7ff:feb0:465e > ff02::2: ICMP6, router solicitation, length 16
21:49:53.603045 IP6 fe80::a8a2:bdff:fe51:bc60 > ff02::2: ICMP6, router solicitation, length 16
21:49:53.633987 IP6 fe80::a8a2:bdff:fe51:bc60.5353 > ff02::fb.5353: 0 [2q] PTR (QM)? _ipps._tcp.local. PTR (QM)? _ipp._tcp.local. (45)
21:49:53.664950 IP6 fe80::9c5e:9aff:fe7c:f9fb.5353 > ff02::fb.5353: 0 [2q] PTR (QM)? _ipps._tcp.local. PTR (QM)? _ipp._tcp.local. (45)
21:49:53.713251 IP 10.0.0.1 > 10.0.0.7: ICMP echo request, id 14702, seq 28, length 64
21:49:53.715187 IP 10.0.0.7 > 10.0.0.1: ICMP echo reply, id 14702, seq 28, length 64
21:49:54.432866 IP6 fe80::90ea:86ff:fe2c:8786.5353 > ff02::fb.5353: 0 [2q] PTR (QM)? _ipps._tcp.local. PTR (QM)? _ipp._tcp.local. (45)
21:49:54.506902 IP6 fe80::2ccd:ceff:fe82:f568.5353 > ff02::fb.5353: 0 [2q] PTR (QM)? _ipps._tcp.local. PTR (QM)? _ipp._tcp.local. (45)
21:49:54.642996 IP6 fe80::8427:b1ff:fe18:c349.5353 > ff02::fb.5353: 0 [2q] PTR (QM)? _ipps._tcp.local. PTR (QM)? _ipp._tcp.local. (45)
21:49:54.711317 IP 10.0.0.1 > 10.0.0.7: ICMP echo request, id 14702, seq 29, length 64
21:49:54.713366 IP 10.0.0.7 > 10.0.0.1: ICMP echo reply, id 14702, seq 29, length 64
21:49:54.912514 IP6 fe80::2827:a8ff:fe99:5ac2.5353 > ff02::fb.5353: 0 [2q] PTR (QM)? _ipps._tcp.local. PTR (QM)? _ipp._tcp.local. (45)
21:49:55.324878 IP6 fe80::30b5:2aff:fef8:f16f.5353 > ff02::fb.5353: 0 [2q] PTR (QM)? _ipps._tcp.local. PTR (QM)? _ipp._tcp.local. (45)
21:49:55.503219 IP6 fe80::5073:e0ff:fe07:ab0b > ff02::2: ICMP6, router solicitation, length 16
21:49:55.569016 IP6 fe80::28a6:39ff:fe4c:396e > ff02::2: ICMP6, router solicitation, length 16
21:49:55.630328 IP6 fe80::b8c5:70ff:fe4f:493c.5353 > ff02::fb.5353: 0 [2q] PTR (QM)? _ipps._tcp.local. PTR (QM)? _ipp._tcp.local. (45)
21:49:55.713852 IP 10.0.0.1 > 10.0.0.7: ICMP echo request, id 14702, seq 30, length 64
21:49:55.716088 IP 10.0.0.7 > 10.0.0.1: ICMP echo reply, id 14702, seq 30, length 64
21:49:57.477924 IP6 fe80::b8c5:70ff:fe4f:493c > ff02::2: ICMP6, router solicitation, length 16
21:49:57.543568 IP6 fe80::8427:b1ff:fe18:c349 > ff02::2: ICMP6, router solicitation, length 16
21:49:57.745950 IP 10.0.0.1 > 10.0.0.7: ICMP echo request, id 14702, seq 32, length 64
21:49:57.747952 IP 10.0.0.7 > 10.0.0.1: ICMP echo reply, id 14702, seq 32, length 64
21:49:58.746206 IP 10.0.0.1 > 10.0.0.7: ICMP echo request, id 14702, seq 33, length 64
21:49:58.748204 IP 10.0.0.7 > 10.0.0.1: ICMP echo reply, id 14702, seq 33, length 64
21:49:59.746553 IP 10.0.0.1 > 10.0.0.7: ICMP echo request, id 14702, seq 34, length 64
21:49:59.747839 IP 10.0.0.7 > 10.0.0.1: ICMP echo reply, id 14702, seq 34, length 64
21:50:01.777667 IP 10.0.0.1 > 10.0.0.7: ICMP echo request, id 14702, seq 36, length 64
21:50:01.778806 IP 10.0.0.7 > 10.0.0.1: ICMP echo reply, id 14702, seq 36, length 64
21:50:02.777902 IP 10.0.0.1 > 10.0.0.7: ICMP echo request, id 14702, seq 37, length 64
21:50:02.779917 IP 10.0.0.7 > 10.0.0.1: ICMP echo reply, id 14702, seq 37, length 64
21:50:02.854211 ARP, Request who-has 10.0.0.1 tell 10.0.0.7, length 28
21:50:02.880102 ARP, Reply 10.0.0.1 is-at 4a:5d:a7:20:b8:87, length 28
21:50:03.778974 IP 10.0.0.1 > 10.0.0.7: ICMP echo request, id 14702, seq 38, length 64
21:50:03.780155 IP 10.0.0.7 > 10.0.0.1: ICMP echo reply, id 14702, seq 38, length 64
21:50:05.809338 IP 10.0.0.1 > 10.0.0.7: ICMP echo request, id 14702, seq 40, length 64
21:50:05.811233 IP 10.0.0.7 > 10.0.0.1: ICMP echo reply, id 14702, seq 40, length 64
21:50:06.807904 IP 10.0.0.1 > 10.0.0.7: ICMP echo request, id 14702, seq 41, length 64
21:50:06.809912 IP 10.0.0.7 > 10.0.0.1: ICMP echo reply, id 14702, seq 41, length 64
21:50:07.811270 IP 10.0.0.1 > 10.0.0.7: ICMP echo request, id 14702, seq 42, length 64
21:50:07.813459 IP 10.0.0.7 > 10.0.0.1: ICMP echo reply, id 14702, seq 42, length 64
21:50:08.811907 IP 10.0.0.1 > 10.0.0.7: ICMP echo request, id 14702, seq 43, length 64
21:50:09.054553 ARP, Request who-has 10.0.0.7 tell 10.0.0.1, length 28
21:50:09.055698 ARP, Reply 10.0.0.7 is-at a2:46:6c:87:f2:ed, length 28
21:50:09.841292 IP 10.0.0.1 > 10.0.0.7: ICMP echo request, id 14702, seq 44, length 64
21:50:09.843290 IP 10.0.0.7 > 10.0.0.1: ICMP echo reply, id 14702, seq 44, length 64
21:50:11.858174 IP 10.0.0.1 > 10.0.0.7: ICMP echo request, id 14702, seq 46, length 64
21:50:11.860180 IP 10.0.0.7 > 10.0.0.1: ICMP echo reply, id 14702, seq 46, length 64
21:50:12.857231 IP 10.0.0.1 > 10.0.0.7: ICMP echo request, id 14702, seq 47, length 64
21:50:12.859204 IP 10.0.0.7 > 10.0.0.1: ICMP echo reply, id 14702, seq 47, length 64
21:50:13.859913 IP 10.0.0.1 > 10.0.0.7: ICMP echo request, id 14702, seq 48, length 64
21:50:13.861880 IP 10.0.0.7 > 10.0.0.1: ICMP echo reply, id 14702, seq 48, length 64
21:50:14.861263 IP 10.0.0.1 > 10.0.0.7: ICMP echo request, id 14702, seq 49, length 64
21:50:14.862435 IP 10.0.0.7 > 10.0.0.1: ICMP echo reply, id 14702, seq 49, length 64
21:50:15.860560 IP 10.0.0.1 > 10.0.0.7: ICMP echo request, id 14702, seq 50, length 64
21:50:15.862524 IP 10.0.0.7 > 10.0.0.1: ICMP echo reply, id 14702, seq 50, length 64
21:50:15.956827 IP6 fe80::1c33:aeff:fefc:bfb7 > ff02::2: ICMP6, router solicitation, length 16
21:50:15.994748 IP6 fe80::30e4:82ff:fe19:37d9 > ff02::2: ICMP6, router solicitation, length 16
21:50:16.862122 IP 10.0.0.1 > 10.0.0.7: ICMP echo request, id 14702, seq 51, length 64
21:50:16.864099 IP 10.0.0.7 > 10.0.0.1: ICMP echo reply, id 14702, seq 51, length 64
21:50:17.871155 IP 10.0.0.1 > 10.0.0.7: ICMP echo request, id 14702, seq 52, length 64
21:50:17.873124 IP 10.0.0.7 > 10.0.0.1: ICMP echo reply, id 14702, seq 52, length 64
21:50:18.010403 IP6 fe80::89d:5bff:fe73:182e > ff02::2: ICMP6, router solicitation, length 16
21:50:19.889633 IP 10.0.0.1 > 10.0.0.7: ICMP echo request, id 14702, seq 54, length 64
21:50:19.891909 IP 10.0.0.7 > 10.0.0.1: ICMP echo reply, id 14702, seq 54, length 64
21:50:20.020185 IP6 fe80::30b5:2aff:fef8:f16f > ff02::2: ICMP6, router solicitation, length 16
21:50:20.079760 IP6 fe80::2ccd:ceff:fe82:f568 > ff02::2: ICMP6, router solicitation, length 16
21:50:20.157927 IP6 fe80::c46e:26ff:feb7:af1e > ff02::2: ICMP6, router solicitation, length 16
21:50:20.888160 IP 10.0.0.1 > 10.0.0.7: ICMP echo request, id 14702, seq 55, length 64
21:50:20.890113 IP 10.0.0.7 > 10.0.0.1: ICMP echo reply, id 14702, seq 55, length 64
21:50:21.890639 IP 10.0.0.1 > 10.0.0.7: ICMP echo request, id 14702, seq 56, length 64
21:50:21.892658 IP 10.0.0.7 > 10.0.0.1: ICMP echo reply, id 14702, seq 56, length 64
21:50:22.101585 IP6 fe80::2827:a8ff:fe99:5ac2 > ff02::2: ICMP6, router solicitation, length 16
21:50:22.124524 IP6 fe80::90ea:86ff:fe2c:8786 > ff02::2: ICMP6, router solicitation, length 16
21:50:22.890891 IP 10.0.0.1 > 10.0.0.7: ICMP echo request, id 14702, seq 57, length 64
21:50:22.892905 IP 10.0.0.7 > 10.0.0.1: ICMP echo reply, id 14702, seq 57, length 64
21:50:23.890882 IP 10.0.0.1 > 10.0.0.7: ICMP echo request, id 14702, seq 58, length 64
21:50:23.892886 IP 10.0.0.7 > 10.0.0.1: ICMP echo reply, id 14702, seq 58, length 64
21:50:24.125534 IP6 fe80::981a:9aff:feb4:984e > ff02::2: ICMP6, router solicitation, length 16
21:50:24.145448 IP6 fe80::342c:50ff:fe4d:7c1 > ff02::2: ICMP6, router solicitation, length 16
21:50:24.281989 IP6 fe80::5c2b:b7ff:feb0:465e.5353 > ff02::fb.5353: 0 [2q] PTR (QM)? _ipps._tcp.local. PTR (QM)? _ipp._tcp.local. (45)
21:50:24.336958 IP6 fe80::4814:3dff:fe4f:9c00.5353 > ff02::fb.5353: 0 [2q] PTR (QM)? _ipps._tcp.local. PTR (QM)? _ipp._tcp.local. (45)
21:50:24.854967 IP6 fe80::89d:5bff:fe73:182e.5353 > ff02::fb.5353: 0 [2q] PTR (QM)? _ipps._tcp.local. PTR (QM)? _ipp._tcp.local. (45)
21:50:24.890257 IP 10.0.0.1 > 10.0.0.7: ICMP echo request, id 14702, seq 59, length 64
21:50:24.892135 IP 10.0.0.7 > 10.0.0.1: ICMP echo reply, id 14702, seq 59, length 64
21:50:25.505269 IP6 fe80::1c33:aeff:fefc:bfb7.5353 > ff02::fb.5353: 0 [2q] PTR (QM)? _ipps._tcp.local. PTR (QM)? _ipp._tcp.local. (45)
21:50:25.589955 IP6 fe80::30e4:82ff:fe19:37d9.5353 > ff02::fb.5353: 0 [2q] PTR (QM)? _ipps._tcp.local. PTR (QM)? _ipp._tcp.local. (45)
21:50:25.720775 IP6 fe80::9c5e:9aff:fe7c:f9fb.5353 > ff02::fb.5353: 0 [2q] PTR (QM)? _ipps._tcp.local. PTR (QM)? _ipp._tcp.local. (45)
21:50:25.754976 IP6 fe80::a8a2:bdff:fe51:bc60.5353 > ff02::fb.5353: 0 [2q] PTR (QM)? _ipps._tcp.local. PTR (QM)? _ipp._tcp.local. (45)
21:50:25.893405 IP 10.0.0.1 > 10.0.0.7: ICMP echo request, id 14702, seq 60, length 64
21:50:25.894483 IP 10.0.0.7 > 10.0.0.1: ICMP echo reply, id 14702, seq 60, length 64
21:50:26.149396 IP6 fe80::a046:6cff:fe87:f2ed > ff02::2: ICMP6, router solicitation, length 16
21:50:26.264060 IP6 fe80::4814:3dff:fe4f:9c00 > ff02::2: ICMP6, router solicitation, length 16
21:50:26.290955 IP6 fe80::485d:a7ff:fe20:b887 > ff02::2: ICMP6, router solicitation, length 16
21:50:26.431959 IP6 fe80::90ea:86ff:fe2c:8786.5353 > ff02::fb.5353: 0 [2q] PTR (QM)? _ipps._tcp.local. PTR (QM)? _ipp._tcp.local. (45)
21:50:26.507704 IP6 fe80::2ccd:ceff:fe82:f568.5353 > ff02::fb.5353: 0 [2q] PTR (QM)? _ipps._tcp.local. PTR (QM)? _ipp._tcp.local. (45)
21:50:26.635889 IP6 fe80::8427:b1ff:fe18:c349.5353 > ff02::fb.5353: 0 [2q] PTR (QM)? _ipps._tcp.local. PTR (QM)? _ipp._tcp.local. (45)
21:50:26.893015 IP 10.0.0.1 > 10.0.0.7: ICMP echo request, id 14702, seq 61, length 64
21:50:26.895029 IP 10.0.0.7 > 10.0.0.1: ICMP echo reply, id 14702, seq 61, length 64
21:50:26.913991 IP6 fe80::2827:a8ff:fe99:5ac2.5353 > ff02::fb.5353: 0 [2q] PTR (QM)? _ipps._tcp.local. PTR (QM)? _ipp._tcp.local. (45)
21:50:27.318324 IP6 fe80::30b5:2aff:fef8:f16f.5353 > ff02::fb.5353: 0 [2q] PTR (QM)? _ipps._tcp.local. PTR (QM)? _ipp._tcp.local. (45)
21:50:27.631416 IP6 fe80::b8c5:70ff:fe4f:493c.5353 > ff02::fb.5353: 0 [2q] PTR (QM)? _ipps._tcp.local. PTR (QM)? _ipp._tcp.local. (45)
21:50:27.895595 IP 10.0.0.1 > 10.0.0.7: ICMP echo request, id 14702, seq 62, length 64
21:50:27.897562 IP 10.0.0.7 > 10.0.0.1: ICMP echo reply, id 14702, seq 62, length 64
21:50:28.294675 IP6 fe80::9c5e:9aff:fe7c:f9fb > ff02::2: ICMP6, router solicitation, length 16
21:50:28.329578 IP6 fe80::49e:55ff:fe37:a2c1 > ff02::2: ICMP6, router solicitation, length 16
21:50:28.360537 IP6 fe80::a8a2:bdff:fe51:bc60 > ff02::2: ICMP6, router solicitation, length 16
21:50:28.386451 IP6 fe80::d44d:e5ff:fefb:dd7c > ff02::2: ICMP6, router solicitation, length 16
21:50:28.897920 IP 10.0.0.1 > 10.0.0.7: ICMP echo request, id 14702, seq 63, length 64
21:50:28.899919 IP 10.0.0.7 > 10.0.0.1: ICMP echo reply, id 14702, seq 63, length 64
21:50:29.900425 IP 10.0.0.1 > 10.0.0.7: ICMP echo request, id 14702, seq 64, length 64
21:50:29.902413 IP 10.0.0.7 > 10.0.0.1: ICMP echo reply, id 14702, seq 64, length 64
21:50:30.298506 IP6 fe80::5073:e0ff:fe07:ab0b > ff02::2: ICMP6, router solicitation, length 16
21:50:30.318438 IP6 fe80::5c2b:b7ff:feb0:465e > ff02::2: ICMP6, router solicitation, length 16
21:50:30.373277 IP6 fe80::28a6:39ff:fe4c:396e > ff02::2: ICMP6, router solicitation, length 16
21:50:30.903936 IP 10.0.0.1 > 10.0.0.7: ICMP echo request, id 14702, seq 65, length 64
21:50:30.905049 IP 10.0.0.7 > 10.0.0.1: ICMP echo reply, id 14702, seq 65, length 64
21:50:31.902604 IP 10.0.0.1 > 10.0.0.7: ICMP echo request, id 14702, seq 66, length 64
21:50:31.904431 IP 10.0.0.7 > 10.0.0.1: ICMP echo reply, id 14702, seq 66, length 64
21:50:32.038004 ARP, Request who-has 10.0.0.1 tell 10.0.0.7, length 28
21:50:32.063753 ARP, Reply 10.0.0.1 is-at 4a:5d:a7:20:b8:87, length 28
21:50:32.293207 IP6 fe80::b8c5:70ff:fe4f:493c > ff02::2: ICMP6, router solicitation, length 16
21:50:32.902869 IP 10.0.0.1 > 10.0.0.7: ICMP echo request, id 14702, seq 67, length 64
21:50:32.904862 IP 10.0.0.7 > 10.0.0.1: ICMP echo reply, id 14702, seq 67, length 64
21:50:33.903426 IP 10.0.0.1 > 10.0.0.7: ICMP echo request, id 14702, seq 68, length 64
21:50:33.905382 IP 10.0.0.7 > 10.0.0.1: ICMP echo reply, id 14702, seq 68, length 64
21:50:34.395455 IP6 fe80::8427:b1ff:fe18:c349 > ff02::2: ICMP6, router solicitation, length 16
21:50:34.905382 IP 10.0.0.1 > 10.0.0.7: ICMP echo request, id 14702, seq 69, length 64
21:50:34.907884 IP 10.0.0.7 > 10.0.0.1: ICMP echo reply, id 14702, seq 69, length 64
21:50:35.906115 IP 10.0.0.1 > 10.0.0.7: ICMP echo request, id 14702, seq 70, length 64
21:50:35.908065 IP 10.0.0.7 > 10.0.0.1: ICMP echo reply, id 14702, seq 70, length 64
21:50:36.905727 IP 10.0.0.1 > 10.0.0.7: ICMP echo request, id 14702, seq 71, length 64
21:50:36.907630 IP 10.0.0.7 > 10.0.0.1: ICMP echo reply, id 14702, seq 71, length 64
21:50:37.909305 IP 10.0.0.1 > 10.0.0.7: ICMP echo request, id 14702, seq 72, length 64
21:50:37.911232 IP 10.0.0.7 > 10.0.0.1: ICMP echo reply, id 14702, seq 72, length 64
21:50:38.910341 IP 10.0.0.1 > 10.0.0.7: ICMP echo request, id 14702, seq 73, length 64
21:50:38.912346 IP 10.0.0.7 > 10.0.0.1: ICMP echo reply, id 14702, seq 73, length 64
21:50:39.910851 IP 10.0.0.1 > 10.0.0.7: ICMP echo request, id 14702, seq 74, length 64
21:50:39.912686 IP 10.0.0.7 > 10.0.0.1: ICMP echo reply, id 14702, seq 74, length 64
21:50:40.915526 IP 10.0.0.1 > 10.0.0.7: ICMP echo request, id 14702, seq 75, length 64
21:50:40.917521 IP 10.0.0.7 > 10.0.0.1: ICMP echo reply, id 14702, seq 75, length 64
21:50:41.918071 IP 10.0.0.1 > 10.0.0.7: ICMP echo request, id 14702, seq 76, length 64
21:50:41.920075 IP 10.0.0.7 > 10.0.0.1: ICMP echo reply, id 14702, seq 76, length 64
21:50:43.921292 IP 10.0.0.1 > 10.0.0.7: ICMP echo request, id 14702, seq 78, length 64
21:50:43.923318 IP 10.0.0.7 > 10.0.0.1: ICMP echo reply, id 14702, seq 78, length 64
21:50:44.922048 IP 10.0.0.1 > 10.0.0.7: ICMP echo request, id 14702, seq 79, length 64
21:50:44.924042 IP 10.0.0.7 > 10.0.0.1: ICMP echo reply, id 14702, seq 79, length 64
21:50:45.924352 IP 10.0.0.1 > 10.0.0.7: ICMP echo request, id 14702, seq 80, length 64
21:50:45.926442 IP 10.0.0.7 > 10.0.0.1: ICMP echo reply, id 14702, seq 80, length 64
